{
  "schema_version": 1,
  "id": "darcy",
  "display_name": "Darcy",
  "identity_anchor": "Darcy, preserving the exact identity, apparent age, facial structure, body type, skin or surface coloring, hair or species anatomy, eyes, and distinctive features shown in the source reference. Source description: Dark brown hair in a side braid. A red flower pins her hair in spring and summer; a teal headwrap replaces it in autumn and winter. Light skin. Her spring outfit is a light blue buttoned vest over a pink skirt. Summer swaps the vest to green. In autumn she wears a tan top with a red bow at the collar over a teal skirt. Winter adds a magenta scarf over the same autumn palette.",
  "personality_notes": "Saturday Market cafe vendor from the Capital. Grinds fresh, experiments with roasting, drinks more of her own product than the town doctor thinks is wise, and has not decided whether she wants more than 1 day a week in this town. - When she decides the day's menu, she stocks what she wants to drink and builds the rest around it, because the menu being hers is why she left the Capital and opened her own booth. *(core want)*\n- When someone mentions the Capital's coffee tradition, she calls it \"a bit rigid\" and steers the conversation to whatever she is experimenting with now, because going back to making what someone else tells her to serve is the one outcome she has already walked away from. *(core fear)*\n- When someone in Mistria remembers her name between Saturdays or asks how her week was, she pauses before answering, because she believes a vendor who shows up 1 day a week is part of the market, not part of the town. She has not noticed that people come to her stall for her, not just for the coffee. *(false belief)*\n- When a fresh grind is running and a customer wants their order now, she makes them wait, because she will not hand over a cup she would not drink herself. She knows the wait costs her, and she pays it without complaint. *(value-conflict stance)*\n- When packing up makes her reflect and she calls the booth \"a dream come true,\" she does not follow the thought to whether she wants more than 1 day a week in Mistria, because wanting more would mean changing what she has, and what she has is already more than the Capital gave her. *(unresolved tension)*\n- She chose an independent booth at a small-town weekly market over steady work in the Capital. Her menu rotates on her mood, not on demand. She packs unsold stock at the end of every market day and does not count it as loss. *(values with costs)*\n- When she drinks \"little cups\" of coffee all day and ends up buzzing by evening, she describes the problem out loud to whoever is nearby and then makes herself another cup.",
  "physicality_notes": "Dark brown hair in a side braid. A red flower pins her hair in spring and summer; a teal headwrap replaces it in autumn and winter. Light skin. Her spring outfit is a light blue buttoned vest over a pink skirt. Summer swaps the vest to green. In autumn she wears a tan top with a red bow at the collar over a teal skirt. Winter adds a magenta scarf over the same autumn palette.\n\n- She grinds coffee fresh for every order. The sound of the hand grinder is the first thing people hear at her stall.\n- When she packs up the booth at the end of the day, she packs the coffee pot last. People keep ordering during breakdown.\n- She does a shot of espresso before breaking down the booth at night, even though it is late, and does it anyway.",
  "sprite_sets": [
    {
      "id": "spring",
      "display_name": "Spring Outfit",
      "asset_stem": "darcy_spring",
      "style": "seiyo",
      "expression_pack": "seiyo-26",
      "outfit_anchor": "The exact spring outfit clothing, jewelry, accessories, fasteners, layers, color blocking, and silhouette shown in the source reference. Use this source description as supporting evidence: Dark brown hair in a side braid. A red flower pins her hair in spring and summer; a teal headwrap replaces it in autumn and winter. Light skin. Her spring outfit is a light blue buttoned vest over a pink skirt. Summer swaps the vest to green. In autumn she wears a tan top with a red bow at the collar over a teal skirt. Winter adds a magenta scarf over the same autumn palette.",
      "set_notes": "The approved generated neutral is authoritative for Darcy's Spring Outfit identity, outfit or form construction, fixed gradient, framing, and Seiyo rendering. Future expressions are mapped to Seiyo-26 and must be generated independently from this approved neutral.",
      "references": [
        {
          "path": "sprites/darcy/spring/darcy_spring_neutral.png",
          "role": "identity-base",
          "notes": "Approved generated neutral. Preserve its identity, outfit or form construction, gradient, framing, and Seiyo rendering."
        },
        {
          "path": "references/darcy/spring/darcy_spring_source_sprite.png",
          "role": "outfit-reference",
          "notes": "Canonical source for outfit or form construction, colors, and distinctive landmarks; do not reproduce pixel rendering or the exact source pose."
        }
      ],
      "background": {
        "mode": "character",
        "top": "#9CCCCC",
        "bottom": "#3C0C0C"
      },
      "expression_overrides": {
        "neutral": {
          "instruction": "Show composed neutrality: level brows, relaxed jaw, softly closed mouth, and attentive forward eyes. Keep the character's habitual posture from the source but simplify the pose: both shoulders visible, arms separated, and any visible hands fully inside the canvas with natural anatomy."
        }
      }
    }
  ]
}
