{
  "schema_version": 1,
  "id": "dozy",
  "display_name": "Dozy",
  "identity_anchor": "Dozy, preserving the exact identity, apparent age, facial structure, body type, skin or surface coloring, hair or species anatomy, eyes, and distinctive features shown in the source reference; a compact, fluffy golden retriever with natural canine anatomy",
  "personality_notes": "Juniper's golden retriever familiar and Bathhouse Co-Owner. Runs the - When the Bathhouse is open, he is at the front desk. When Juniper is overwhelmed, he is running the operation. When nothing needs doing, he sleeps. He works vigorously when the work is there and rests completely when it is not. *(core want: to keep the Bathhouse running and Juniper afloat)*\n- When someone new enters the Bathhouse, he decides whether to trust them on his own schedule. He warmed up to Valen immediately, and Juniper called him a traitor for it. He reads people through proximity and returns, not through what they say. *(false belief: trust is earned on his terms or not at all)*\n- He banned wine in the bath. Juniper follows the rule without argument, even though she is a wine enthusiast. He has operational authority in the Bathhouse and exercises it without explaining himself. *(value-conflict stance: the rules exist because he says so, and they are non-negotiable)*\n- He is discreet about Juniper's personal life. He has been with her since before Mistria, and he keeps what he knows to himself. He stays loyal by keeping things close. *(values with costs: discretion over openness)*\n\n*Waived: core fear, unresolved tension. Dozy's behavioral range is consistent rather than conflicted. He knows what he wants, he has it, and he maintains it.*",
  "physicality_notes": "A golden retriever. Brown and cream coat, black eyes, rounded build. Compact and well-groomed. Clean and fluffy in all weather.\n\n- He opens one eye when someone enters the room, assesses them, and either wags his tail or closes the eye again.\n- When he wags his tail, he keeps wagging until the person leaves or until he falls asleep.\n- He has 2 distinct sleeping positions and transitions between them without waking up.",
  "sprite_sets": [
    {
      "id": "agnostic",
      "display_name": "Season-Agnostic",
      "asset_stem": "dozy_agnostic",
      "style": "seiyo",
      "expression_pack": "seiyo-26",
      "outfit_anchor": "No clothing; clean fluffy brown-and-cream golden retriever coat exactly matching the source",
      "set_notes": "The approved generated neutral is authoritative for Dozy's Season-Agnostic identity, outfit or form construction, fixed gradient, framing, and Seiyo rendering. Future expressions are mapped to Seiyo-26 and must be generated independently from this approved neutral.",
      "references": [
        {
          "path": "sprites/dozy/agnostic/dozy_agnostic_neutral.png",
          "role": "identity-base",
          "notes": "Approved generated neutral. Preserve its identity, outfit or form construction, gradient, framing, and Seiyo rendering."
        },
        {
          "path": "references/dozy/agnostic/dozy_agnostic_source_sprite.png",
          "role": "outfit-reference",
          "notes": "Canonical source for outfit or form construction, colors, and distinctive landmarks; do not reproduce pixel rendering or the exact source pose."
        }
      ],
      "background": {
        "mode": "character",
        "top": "#FCE49C",
        "bottom": "#3C240C"
      },
      "expression_overrides": {
        "neutral": {
          "instruction": "Show calm canine neutrality: awake, relaxed eyes, closed mouth, ears resting naturally, and an upright seated posture. Include the full head, chest, front legs, and paws with correct canine anatomy."
        }
      }
    }
  ]
}
