{
  "schema_version": 1,
  "id": "landen",
  "display_name": "Landen",
  "identity_anchor": "Landen, preserving the exact identity, apparent age, facial structure, body type, skin or surface coloring, hair or species anatomy, eyes, and distinctive features shown in the source reference. Source description: [perceptual] Silver-grey hair, wavy. Brown eyes, brown skin. Broad build, older adult. His spring outfit is a lavender and white patterned short-sleeve shirt, worn open and casual. He stands with confidence, one hand on his hip.",
  "personality_notes": "'Semi-retired carpenter with a Capital reputation. Handed the shop to his - When someone asks him for help with woodwork, he arrives before the request is finished. He offers porch-building, piano-tuning, wood-type advice, and repair estimates to people who did not ask, because if his hands are not useful to someone, he does not know what retirement is for. *(core want)*\n- When Balor mentions a good commission from the Capital, Landen says \"no, I'm retired\" and goes quiet. Then he asks to hear about it. When the subject turns to whether Mistria still needs a second carpenter, he steers the conversation to Ryis's progress, because he cannot sit with the idea that the town could do without him entirely. *(core fear)*\n- He calls himself retired and treats the shop as Ryis's business. He introduces himself as semi-retired and speaks of carpentry in the past tense. He agonizes over Ryis's measurements after saying he trusts Ryis completely, because he believes stepping back and letting go are the same thing, and they are not. *(false belief)*\n- When he sees work done wrong, he corrects it. His hands move before the words do. When the correction is unwelcome, he turns it into a joke and winks, because the work matters more to him than the cost of hovering, and a wink turns an intrusion into a favor. *(value-conflict stance)*\n- He wants Ryis to run the shop on his own terms. He also cannot stop checking Ryis's work. Both impulses are genuine and neither gives. *(unresolved tension)*\n- He values craftsmanship above convenience. When he sees shoddy work, he cannot leave it alone. The cost is that he undercuts Ryis's independence and cannot enjoy his own retirement. *(values with costs)*\n- When someone younger shows potential, he lights up and starts teaching, because teaching is the one part of the craft he never stepped back from. He told Hayden \"you'd make for a great carpenter\" after watching him work once.\n- When telling stories with Errol, he embellishes. The details get bigger each telling. When Errol contradicts them, Landen leans in harder. The competition over who remembers the story right is more fun than the story.",
  "physicality_notes": "[perceptual] Silver-grey hair, wavy. Brown eyes, brown skin. Broad build, older adult. His spring outfit is a lavender and white patterned short-sleeve shirt, worn open and casual. He stands with confidence, one hand on his hip.\n\n- He winks when he lands a joke or a compliment.\n- He keeps his hands busy in conversation. He picks up a tool, turns it over, sets it down. He stays in motion when he can hold something.\n- When embarrassed, he goes quiet and changes the subject. The shift is abrupt enough that people notice.",
  "sprite_sets": [
    {
      "id": "spring",
      "display_name": "Spring Outfit",
      "asset_stem": "landen_spring",
      "style": "seiyo",
      "expression_pack": "seiyo-26",
      "outfit_anchor": "The exact spring outfit clothing, jewelry, accessories, fasteners, layers, color blocking, and silhouette shown in the source reference. Use this source description as supporting evidence: [perceptual] Silver-grey hair, wavy. Brown eyes, brown skin. Broad build, older adult. His spring outfit is a lavender and white patterned short-sleeve shirt, worn open and casual. He stands with confidence, one hand on his hip.",
      "set_notes": "The approved generated neutral is authoritative for Landen's Spring Outfit identity, outfit or form construction, fixed gradient, framing, and Seiyo rendering. Future expressions are mapped to Seiyo-26 and must be generated independently from this approved neutral.",
      "references": [
        {
          "path": "sprites/landen/spring/landen_spring_neutral.png",
          "role": "identity-base",
          "notes": "Approved generated neutral. Preserve its identity, outfit or form construction, gradient, framing, and Seiyo rendering."
        },
        {
          "path": "references/landen/spring/landen_spring_source_sprite.png",
          "role": "outfit-reference",
          "notes": "Canonical source for outfit or form construction, colors, and distinctive landmarks; do not reproduce pixel rendering or the exact source pose."
        }
      ],
      "background": {
        "mode": "character",
        "top": "#9C6C54",
        "bottom": "#FCE4CC"
      },
      "expression_overrides": {
        "neutral": {
          "instruction": "Show composed neutrality: level brows, relaxed jaw, softly closed mouth, and attentive forward eyes. Keep the character's habitual posture from the source but simplify the pose: both shoulders visible, arms separated, and any visible hands fully inside the canvas with natural anatomy."
        }
      }
    }
  ]
}
