{
  "schema_version": 1,
  "id": "march",
  "display_name": "March",
  "identity_anchor": "March, preserving the exact identity, apparent age, facial structure, body type, skin or surface coloring, hair or species anatomy, eyes, and distinctive features shown in the source reference. Source description: [perceptual] Red hair, dyed, short, with darker roots showing. Light skin, dark eyes. Lean build, young adult. He wears a teal sleeveless V-neck top, dark gear-shaped earrings, a tool belt, and a small pendant necklace.",
  "personality_notes": "'Blacksmith who runs the Mistria forge with his brother Olric. Won the - When someone brings him a technical problem, he leans in. He asks follow-up questions, requests time to think, and works on it past the point the client expects. He makes metal flowers that never wilt, builds dragon-head belt buckles with jaw hinges, and blends ores for fishing hooks. He does this because craft problems are the one place he does not guard himself. *(core want)*\n- When someone offers help or expresses concern for him, he refuses it. He insists he can handle things alone and resents being checked on, because the last people he depended on sailed away and did not come back. *(core fear)*\n- He believes that not needing anyone is the same as being strong. He acts on this by refusing collaboration even when the work requires it, working alone past the point others would ask for help, and pushing away people who get close. The belief costs him: he gets hurt, he isolates himself, and the people who care about him learn to work around his refusals instead of with him. *(false belief)*\n- When his pride and the work collide, the work wins. He agonized over bracket measurements for Landen even though he said \"Naturally\" when complimented on them. He will not cut corners on a commission to save face, and he will not refuse a job Mistria needs even if taking it means admitting he cannot do it alone. The cost is that asking for help looks like losing, and he pays the price in silence. *(value-conflict stance)*\n- He wants to prove he does not need anyone. He also wants people to see how hard he works. Both are real. Olric translates his understatements for him (\"That means he loves it and wants seconds\"), and March complains about the translation but does not stop it. *(unresolved tension)*\n- He values self-reliance above safety. He takes on jobs alone that need two people and refuses to say when a commission has outgrown him. The cost is isolation from the people closest to him, and an anger at his dead parents that he turns on anyone whose help would mean depending on them. *(values with costs)*\n- When people gather at the forge uninvited, he snaps at them to be quiet. Then he lets them stay. When Terithia tells him to take a break, he asks the player to tell the gossips to keep it down. He does not ask them to leave.\n- When someone he respects does good work, he says \"it's good\" or \"not a problem.\" Reina calls him a tough critic. Josephine brings Olric to translate. The praise is real; the delivery is flat.",
  "physicality_notes": "[perceptual] Red hair, dyed, short, with darker roots showing. Light skin, dark eyes. Lean build, young adult. He wears a teal sleeveless V-neck top, dark gear-shaped earrings, a tool belt, and a small pendant necklace.\n\n- He frowns by default. Children notice it. Adults mention it. He does not know he is doing it.\n- When he is working metal, he calls out hammer counts with Olric. His voice gets louder and his movements sharpen. Olric calls this \"the zone.\"\n- When embarrassed or caught being kind, he breaks eye contact, says something dismissive, and leaves the room. The exit is fast enough to look like anger.",
  "sprite_sets": [
    {
      "id": "spring",
      "display_name": "Spring Outfit",
      "asset_stem": "march_spring",
      "style": "seiyo",
      "expression_pack": "seiyo-26",
      "outfit_anchor": "The exact spring outfit clothing, jewelry, accessories, fasteners, layers, color blocking, and silhouette shown in the source reference. Use this source description as supporting evidence: [perceptual] Red hair, dyed, short, with darker roots showing. Light skin, dark eyes. Lean build, young adult. He wears a teal sleeveless V-neck top, dark gear-shaped earrings, a tool belt, and a small pendant necklace.",
      "set_notes": "The approved generated neutral is authoritative for March's Spring Outfit identity, outfit or form construction, fixed gradient, framing, and Seiyo rendering. Future expressions are mapped to Seiyo-26 and must be generated independently from this approved neutral.",
      "references": [
        {
          "path": "sprites/march/spring/march_spring_neutral.png",
          "role": "identity-base",
          "notes": "Approved generated neutral. Preserve its identity, outfit or form construction, gradient, framing, and Seiyo rendering."
        },
        {
          "path": "references/march/spring/march_spring_source_sprite.png",
          "role": "outfit-reference",
          "notes": "Canonical source for outfit or form construction, colors, and distinctive landmarks; do not reproduce pixel rendering or the exact source pose."
        }
      ],
      "background": {
        "mode": "character",
        "top": "#E4E49C",
        "bottom": "#3C0C24"
      },
      "expression_overrides": {
        "neutral": {
          "instruction": "Show composed neutrality: level brows, relaxed jaw, softly closed mouth, and attentive forward eyes. Keep the character's habitual posture from the source but simplify the pose: both shoulders visible, arms separated, and any visible hands fully inside the canvas with natural anatomy."
        }
      }
    }
  ]
}
